{
  "v": "5.12.0",
  "fr": 30,
  "ip": 0,
  "op": 60,
  "w": 400,
  "h": 80,
  "nm": "progress-bar",
  "ddd": 0,
  "assets": [],
  "layers": [
    {
      "ddd": 0,
      "ind": 1,
      "ty": 4,
      "nm": "fill",
      "sr": 1,
      "ks": {
        "o": { "a": 0, "k": 100 },
        "r": { "a": 0, "k": 0 },
        "p": { "a": 0, "k": [20, 40, 0] },
        "a": { "a": 0, "k": [0, 0, 0] },
        "s": { "a": 0, "k": [100, 100, 100] }
      },
      "ao": 0,
      "shapes": [
        {
          "ty": "rc",
          "p": {
            "a": 1,
            "k": [
              { "t": 0,  "s": [0, 0], "i": { "x": [0.2, 0.2], "y": [1, 1] }, "o": { "x": [0.4, 0.4], "y": [0, 0] } },
              { "t": 60, "s": [180, 0] }
            ]
          },
          "s": {
            "a": 1,
            "k": [
              { "t": 0,  "s": [0, 24],   "i": { "x": [0.2, 0.2], "y": [1, 1] }, "o": { "x": [0.4, 0.4], "y": [0, 0] } },
              { "t": 60, "s": [360, 24] }
            ]
          },
          "r": { "a": 0, "k": 6 },
          "nm": "Fill Rect"
        },
        {
          "ty": "fl",
          "c": { "a": 0, "k": [0.13, 0.74, 0.91, 1] },
          "o": { "a": 0, "k": 100 },
          "nm": "Fill"
        },
        {
          "ty": "tr",
          "p": { "a": 0, "k": [0, 0] },
          "a": { "a": 0, "k": [0, 0] },
          "s": { "a": 0, "k": [100, 100] },
          "r": { "a": 0, "k": 0 },
          "o": { "a": 0, "k": 100 },
          "nm": "Transform"
        }
      ],
      "ip": 0,
      "op": 60,
      "st": 0,
      "bm": 0
    },
    {
      "ddd": 0,
      "ind": 2,
      "ty": 4,
      "nm": "track",
      "sr": 1,
      "ks": {
        "o": { "a": 0, "k": 30 },
        "r": { "a": 0, "k": 0 },
        "p": { "a": 0, "k": [200, 40, 0] },
        "a": { "a": 0, "k": [0, 0, 0] },
        "s": { "a": 0, "k": [100, 100, 100] }
      },
      "ao": 0,
      "shapes": [
        {
          "ty": "rc",
          "p": { "a": 0, "k": [0, 0] },
          "s": { "a": 0, "k": [360, 24] },
          "r": { "a": 0, "k": 6 },
          "nm": "Track Rect"
        },
        {
          "ty": "fl",
          "c": { "a": 0, "k": [0.2, 0.22, 0.27, 1] },
          "o": { "a": 0, "k": 100 },
          "nm": "Fill"
        },
        {
          "ty": "tr",
          "p": { "a": 0, "k": [0, 0] },
          "a": { "a": 0, "k": [0, 0] },
          "s": { "a": 0, "k": [100, 100] },
          "r": { "a": 0, "k": 0 },
          "o": { "a": 0, "k": 100 },
          "nm": "Transform"
        }
      ],
      "ip": 0,
      "op": 60,
      "st": 0,
      "bm": 0
    }
  ],
  "markers": [],
  "meta": {
    "g": "open-lottie-ui",
    "a": "open-lottie-ui contributors",
    "k": "progress bar load fill seed",
    "d": "Hand-rolled CC0 seed: a teal rounded-rect progress bar filling 0 -> 360 px over 60 frames with ease-out cubic, on a dim grey track."
  }
}
