{
  "v": "5.12.0",
  "fr": 30,
  "ip": 0,
  "op": 60,
  "w": 200,
  "h": 200,
  "nm": "checkmark-success",
  "ddd": 0,
  "assets": [],
  "layers": [
    {
      "ddd": 0,
      "ind": 1,
      "ty": 4,
      "nm": "check",
      "sr": 1,
      "ks": {
        "o": { "a": 0, "k": 100 },
        "r": { "a": 0, "k": 0 },
        "p": { "a": 0, "k": [100, 100, 0] },
        "a": { "a": 0, "k": [0, 0, 0] },
        "s": {
          "a": 1,
          "k": [
            { "t": 45, "s": [100, 100, 100], "i": { "x": [0.4, 0.4, 0.4], "y": [1, 1, 1] }, "o": { "x": [0.6, 0.6, 0.6], "y": [0, 0, 0] } },
            { "t": 53, "s": [115, 115, 100], "i": { "x": [0.4, 0.4, 0.4], "y": [1, 1, 1] }, "o": { "x": [0.6, 0.6, 0.6], "y": [0, 0, 0] } },
            { "t": 60, "s": [100, 100, 100] }
          ]
        }
      },
      "ao": 0,
      "shapes": [
        {
          "ty": "sh",
          "ks": {
            "a": 0,
            "k": {
              "c": false,
              "v": [[-35, 0], [-10, 25], [40, -25]],
              "i": [[0, 0], [0, 0], [0, 0]],
              "o": [[0, 0], [0, 0], [0, 0]]
            }
          },
          "nm": "Path"
        },
        {
          "ty": "tm",
          "s": { "a": 0, "k": 0 },
          "e": {
            "a": 1,
            "k": [
              { "t": 0,  "s": [0],   "i": { "x": [0.4], "y": [1] }, "o": { "x": [0.6], "y": [0] } },
              { "t": 45, "s": [100] }
            ]
          },
          "o": { "a": 0, "k": 0 },
          "m": 1,
          "nm": "Trim Paths"
        },
        {
          "ty": "st",
          "c": { "a": 0, "k": [0.133, 0.773, 0.369, 1] },
          "o": { "a": 0, "k": 100 },
          "w": { "a": 0, "k": 8 },
          "lc": 2,
          "lj": 2,
          "nm": "Stroke"
        },
        {
          "ty": "tr",
          "p": { "a": 0, "k": [0, 0] },
          "a": { "a": 0, "k": [0, 0] },
          "s": { "a": 0, "k": [100, 100] },
          "r": { "a": 0, "k": 0 },
          "o": { "a": 0, "k": 100 },
          "nm": "Transform"
        }
      ],
      "ip": 0,
      "op": 60,
      "st": 0,
      "bm": 0
    }
  ],
  "markers": [],
  "meta": {
    "g": "open-lottie-ui",
    "a": "open-lottie-ui contributors",
    "k": "checkmark success confirm seed",
    "d": "Hand-rolled CC0 seed: a green checkmark drawing on over 45 frames, then a small scale bounce."
  }
}
