{
  "v": "5.12.0",
  "fr": 30,
  "ip": 0,
  "op": 60,
  "w": 200,
  "h": 200,
  "nm": "typing-dots",
  "ddd": 0,
  "assets": [],
  "layers": [
    {
      "ddd": 0,
      "ind": 1,
      "ty": 4,
      "nm": "dot-1",
      "sr": 1,
      "ks": {
        "o": {
          "a": 1,
          "k": [
            { "t": 0,  "s": [40],  "i": { "x": [0.4], "y": [1] }, "o": { "x": [0.6], "y": [0] } },
            { "t": 10, "s": [100], "i": { "x": [0.4], "y": [1] }, "o": { "x": [0.6], "y": [0] } },
            { "t": 20, "s": [40],  "i": { "x": [0.4], "y": [1] }, "o": { "x": [0.6], "y": [0] } },
            { "t": 60, "s": [40] }
          ]
        },
        "r": { "a": 0, "k": 0 },
        "p": { "a": 0, "k": [80, 100, 0] },
        "a": { "a": 0, "k": [0, 0, 0] },
        "s": { "a": 0, "k": [100, 100, 100] }
      },
      "ao": 0,
      "shapes": [
        {
          "ty": "el",
          "p": { "a": 0, "k": [0, 0] },
          "s": { "a": 0, "k": [12, 12] },
          "nm": "Ellipse"
        },
        {
          "ty": "fl",
          "c": { "a": 0, "k": [0.42, 0.45, 0.5, 1] },
          "o": { "a": 0, "k": 100 },
          "nm": "Fill"
        },
        {
          "ty": "tr",
          "p": { "a": 0, "k": [0, 0] },
          "a": { "a": 0, "k": [0, 0] },
          "s": { "a": 0, "k": [100, 100] },
          "r": { "a": 0, "k": 0 },
          "o": { "a": 0, "k": 100 },
          "nm": "Transform"
        }
      ],
      "ip": 0,
      "op": 60,
      "st": 0,
      "bm": 0
    },
    {
      "ddd": 0,
      "ind": 2,
      "ty": 4,
      "nm": "dot-2",
      "sr": 1,
      "ks": {
        "o": {
          "a": 1,
          "k": [
            { "t": 0,  "s": [40],  "i": { "x": [0.4], "y": [1] }, "o": { "x": [0.6], "y": [0] } },
            { "t": 10, "s": [40],  "i": { "x": [0.4], "y": [1] }, "o": { "x": [0.6], "y": [0] } },
            { "t": 20, "s": [100], "i": { "x": [0.4], "y": [1] }, "o": { "x": [0.6], "y": [0] } },
            { "t": 30, "s": [40],  "i": { "x": [0.4], "y": [1] }, "o": { "x": [0.6], "y": [0] } },
            { "t": 60, "s": [40] }
          ]
        },
        "r": { "a": 0, "k": 0 },
        "p": { "a": 0, "k": [100, 100, 0] },
        "a": { "a": 0, "k": [0, 0, 0] },
        "s": { "a": 0, "k": [100, 100, 100] }
      },
      "ao": 0,
      "shapes": [
        {
          "ty": "el",
          "p": { "a": 0, "k": [0, 0] },
          "s": { "a": 0, "k": [12, 12] },
          "nm": "Ellipse"
        },
        {
          "ty": "fl",
          "c": { "a": 0, "k": [0.42, 0.45, 0.5, 1] },
          "o": { "a": 0, "k": 100 },
          "nm": "Fill"
        },
        {
          "ty": "tr",
          "p": { "a": 0, "k": [0, 0] },
          "a": { "a": 0, "k": [0, 0] },
          "s": { "a": 0, "k": [100, 100] },
          "r": { "a": 0, "k": 0 },
          "o": { "a": 0, "k": 100 },
          "nm": "Transform"
        }
      ],
      "ip": 0,
      "op": 60,
      "st": 0,
      "bm": 0
    },
    {
      "ddd": 0,
      "ind": 3,
      "ty": 4,
      "nm": "dot-3",
      "sr": 1,
      "ks": {
        "o": {
          "a": 1,
          "k": [
            { "t": 0,  "s": [40],  "i": { "x": [0.4], "y": [1] }, "o": { "x": [0.6], "y": [0] } },
            { "t": 20, "s": [40],  "i": { "x": [0.4], "y": [1] }, "o": { "x": [0.6], "y": [0] } },
            { "t": 30, "s": [100], "i": { "x": [0.4], "y": [1] }, "o": { "x": [0.6], "y": [0] } },
            { "t": 40, "s": [40],  "i": { "x": [0.4], "y": [1] }, "o": { "x": [0.6], "y": [0] } },
            { "t": 60, "s": [40] }
          ]
        },
        "r": { "a": 0, "k": 0 },
        "p": { "a": 0, "k": [120, 100, 0] },
        "a": { "a": 0, "k": [0, 0, 0] },
        "s": { "a": 0, "k": [100, 100, 100] }
      },
      "ao": 0,
      "shapes": [
        {
          "ty": "el",
          "p": { "a": 0, "k": [0, 0] },
          "s": { "a": 0, "k": [12, 12] },
          "nm": "Ellipse"
        },
        {
          "ty": "fl",
          "c": { "a": 0, "k": [0.42, 0.45, 0.5, 1] },
          "o": { "a": 0, "k": 100 },
          "nm": "Fill"
        },
        {
          "ty": "tr",
          "p": { "a": 0, "k": [0, 0] },
          "a": { "a": 0, "k": [0, 0] },
          "s": { "a": 0, "k": [100, 100] },
          "r": { "a": 0, "k": 0 },
          "o": { "a": 0, "k": 100 },
          "nm": "Transform"
        }
      ],
      "ip": 0,
      "op": 60,
      "st": 0,
      "bm": 0
    }
  ],
  "markers": [],
  "meta": {
    "g": "open-lottie-ui",
    "a": "open-lottie-ui contributors",
    "k": "typing dots wait chat seed",
    "d": "Hand-rolled CC0 seed: three grey dots pulse in sequence (10-frame phase offset) over 60 frames at 30 fps."
  }
}
