{
  "v": "5.12.0",
  "fr": 30,
  "ip": 0,
  "op": 36,
  "w": 200,
  "h": 200,
  "nm": "heart-beat",
  "ddd": 0,
  "assets": [],
  "layers": [
    {
      "ddd": 0,
      "ind": 1,
      "ty": 4,
      "nm": "heart",
      "sr": 1,
      "ks": {
        "o": { "a": 0, "k": 100 },
        "r": { "a": 0, "k": 0 },
        "p": { "a": 0, "k": [100, 100, 0] },
        "a": { "a": 0, "k": [0, 0, 0] },
        "s": {
          "a": 1,
          "k": [
            { "t": 0,  "s": [100, 100, 100], "i": { "x": [0.3, 0.3, 0.3], "y": [1, 1, 1] }, "o": { "x": [0.7, 0.7, 0.7], "y": [0, 0, 0] } },
            { "t": 6,  "s": [120, 120, 100], "i": { "x": [0.4, 0.4, 0.4], "y": [1, 1, 1] }, "o": { "x": [0.6, 0.6, 0.6], "y": [0, 0, 0] } },
            { "t": 12, "s": [100, 100, 100], "i": { "x": [0.3, 0.3, 0.3], "y": [1, 1, 1] }, "o": { "x": [0.7, 0.7, 0.7], "y": [0, 0, 0] } },
            { "t": 18, "s": [115, 115, 100], "i": { "x": [0.4, 0.4, 0.4], "y": [1, 1, 1] }, "o": { "x": [0.6, 0.6, 0.6], "y": [0, 0, 0] } },
            { "t": 24, "s": [100, 100, 100] }
          ]
        }
      },
      "ao": 0,
      "shapes": [
        {
          "ty": "sh",
          "ks": {
            "a": 0,
            "k": {
              "c": true,
              "v": [[0, 30], [-40, -10], [-40, -30], [-20, -40], [0, -25], [20, -40], [40, -30], [40, -10]],
              "i": [[20, 0], [0, -20], [-10, -8], [-10, 0], [-8, -8], [-8, 0], [0, -8], [10, 10]],
              "o": [[-10, 10], [0, 8], [10, 0], [8, -8], [8, 0], [10, 0], [0, 20], [-20, 0]]
            }
          },
          "nm": "Heart Path"
        },
        {
          "ty": "fl",
          "c": { "a": 0, "k": [0.95, 0.27, 0.27, 1] },
          "o": { "a": 0, "k": 100 },
          "nm": "Fill"
        },
        {
          "ty": "tr",
          "p": { "a": 0, "k": [0, 0] },
          "a": { "a": 0, "k": [0, 0] },
          "s": { "a": 0, "k": [100, 100] },
          "r": { "a": 0, "k": 0 },
          "o": { "a": 0, "k": 100 },
          "nm": "Transform"
        }
      ],
      "ip": 0,
      "op": 36,
      "st": 0,
      "bm": 0
    }
  ],
  "markers": [],
  "meta": {
    "g": "open-lottie-ui",
    "a": "open-lottie-ui contributors",
    "k": "heart beat pulse love seed",
    "d": "Hand-rolled CC0 seed: a rose-red heart double-beating (100 -> 120 -> 100 -> 115 -> 100) over 36 frames at 30 fps."
  }
}
