{
  "v": "5.12.0",
  "fr": 30,
  "ip": 0,
  "op": 60,
  "w": 200,
  "h": 200,
  "nm": "loader-pulse",
  "ddd": 0,
  "assets": [],
  "layers": [
    {
      "ddd": 0,
      "ind": 1,
      "ty": 4,
      "nm": "circle",
      "sr": 1,
      "ks": {
        "o": { "a": 0, "k": 100 },
        "r": { "a": 0, "k": 0 },
        "p": { "a": 0, "k": [100, 100, 0] },
        "a": { "a": 0, "k": [0, 0, 0] },
        "s": {
          "a": 1,
          "k": [
            { "t": 0,  "s": [80, 80, 100],  "i": { "x": [0.4, 0.4, 0.4], "y": [1, 1, 1] }, "o": { "x": [0.6, 0.6, 0.6], "y": [0, 0, 0] } },
            { "t": 30, "s": [110, 110, 100], "i": { "x": [0.4, 0.4, 0.4], "y": [1, 1, 1] }, "o": { "x": [0.6, 0.6, 0.6], "y": [0, 0, 0] } },
            { "t": 60, "s": [80, 80, 100] }
          ]
        }
      },
      "ao": 0,
      "shapes": [
        {
          "ty": "el",
          "p": { "a": 0, "k": [0, 0] },
          "s": { "a": 0, "k": [80, 80] },
          "nm": "Ellipse"
        },
        {
          "ty": "fl",
          "c": { "a": 0, "k": [0.078, 0.722, 0.651, 1] },
          "o": { "a": 0, "k": 100 },
          "nm": "Fill"
        },
        {
          "ty": "tr",
          "p": { "a": 0, "k": [0, 0] },
          "a": { "a": 0, "k": [0, 0] },
          "s": { "a": 0, "k": [100, 100] },
          "r": { "a": 0, "k": 0 },
          "o": { "a": 0, "k": 100 },
          "nm": "Transform"
        }
      ],
      "ip": 0,
      "op": 60,
      "st": 0,
      "bm": 0
    }
  ],
  "markers": [],
  "meta": {
    "g": "open-lottie-ui",
    "a": "open-lottie-ui contributors",
    "k": "loader spinner pulse seed",
    "d": "Hand-rolled CC0 seed loader: a teal circle pulsing 80 → 110 → 80 % over 60 frames at 30 fps."
  }
}
