{
  "v": "5.12.0",
  "fr": 30,
  "ip": 0,
  "op": 60,
  "w": 200,
  "h": 200,
  "nm": "spinner-arc",
  "ddd": 0,
  "assets": [],
  "layers": [
    {
      "ddd": 0,
      "ind": 1,
      "ty": 4,
      "nm": "arc",
      "sr": 1,
      "ks": {
        "o": { "a": 0, "k": 100 },
        "r": {
          "a": 1,
          "k": [
            { "t": 0,  "s": [0],   "i": { "x": [0.5], "y": [0.5] }, "o": { "x": [0.5], "y": [0.5] } },
            { "t": 60, "s": [360] }
          ]
        },
        "p": { "a": 0, "k": [100, 100, 0] },
        "a": { "a": 0, "k": [0, 0, 0] },
        "s": { "a": 0, "k": [100, 100, 100] }
      },
      "ao": 0,
      "shapes": [
        {
          "ty": "el",
          "p": { "a": 0, "k": [0, 0] },
          "s": { "a": 0, "k": [140, 140] },
          "nm": "Ellipse"
        },
        {
          "ty": "tm",
          "s": { "a": 0, "k": 0 },
          "e": { "a": 0, "k": 75 },
          "o": { "a": 0, "k": 0 },
          "m": 1,
          "nm": "Trim Paths"
        },
        {
          "ty": "st",
          "c": { "a": 0, "k": [0.078, 0.722, 0.651, 1] },
          "o": { "a": 0, "k": 100 },
          "w": { "a": 0, "k": 8 },
          "lc": 2,
          "lj": 2,
          "nm": "Stroke"
        },
        {
          "ty": "tr",
          "p": { "a": 0, "k": [0, 0] },
          "a": { "a": 0, "k": [0, 0] },
          "s": { "a": 0, "k": [100, 100] },
          "r": { "a": 0, "k": 0 },
          "o": { "a": 0, "k": 100 },
          "nm": "Transform"
        }
      ],
      "ip": 0,
      "op": 60,
      "st": 0,
      "bm": 0
    }
  ],
  "markers": [],
  "meta": {
    "g": "open-lottie-ui",
    "a": "open-lottie-ui contributors",
    "k": "spinner arc loader seed",
    "d": "Hand-rolled CC0 seed: a teal 3/4-circle arc rotating 360° over 60 frames. Seamlessly loops."
  }
}
